Title,adult,budget,genres,id,imdb_id,original_language,overview,popularity,production_companies,release_date,revenue,runtime,vote_average
Tokyo Ghoul,False,0,"['Action', 'Drama', 'Horror', 'Thriller']",433945,tt5815944,ja,"Ken Kaneki (Masataka Kubota) is a university student. He becomes injured by Rize, a human eating ghoul. Ken is saved from the ghoul when a steel frame falls on Rize. They are both sent to the hospital. Ken receives an organ transplant from Rize and becomes a half ghoul.",0.802191,['Shochiku'],2017-07-29,0.0,119.0,10.0
Siccin 3: Cürmü Ask,False,0,['Horror'],414827,tt6029122,tr,"After a terrible car accident, Sedat will do anything to save a childhood friend – even if it means dealing with demons and ghosts.",0.133286,,2016-09-02,0.0,87.0,10.0
Patient Zero,False,0,"['Action', 'Drama', 'Horror', 'Thriller']",295011,tt3458254,en,"After an unprecedented global pandemic has turned the majority of humankind into violent ""Infected,"" a man gifted with the ability to speak the Infected's new language leads the last survivors on a hunt for Patient Zero and a cure.",1.0834540000000001,"['Screen Gems', 'Vincent Newman Entertainment']",,0.0,0.0,10.0
The Bride from Hades,False,0,['Horror'],108648,tt0163985,ja,"On the night of the summer Obon festival, Hagiwara Shinzaburo meets a beautiful courtesan named Otsuyu. Not knowing she's a ghost, he becomes infatuated by her.",0.076951,,1968-06-15,0.0,89.0,10.0
The Rites of May,False,0,['Horror'],208579,tt0256106,tl,"A young cameraman, Jun Torres, encounters a strange woman, Teresa, in his hometown at the time of Lent.",0.000308,['Cinema Artists'],1977-01-13,0.0,105.0,9.5
Zombie Pizza,False,0,"['Horror', 'Comedy']",434661,tt3793632,en,"After losing his father, a teenage boy decides to continue the family business and deliver pizza by bicycle during the zombie apocalypse.",0.26915,,2017-04-27,0.0,94.0,9.3
Killjoy's Psycho Circus,False,0,['Horror'],422514,tt4933506,en,"Killjoy, the demon of vengeance, trickster god and killer clown has finally made it to Earth! Along with his gruesome crew Freakshow, Punchy and the sexy/psychotic Batty Boop, Killjoy is free to terrorize mortals in new and excruciating ways.",0.168822,"['Full Moon Entertainment', 'Full Moon Features']",2016-10-30,0.0,120.0,9.0
Ghost Adventures,False,0,"['Documentary', 'Horror']",29721,tt2637720,en,"In 2007, The Sci-Fi Channel premiered ""Ghost Adventures,"" a raw documentary in which 3 men go to Virginia City, NV and Goldfield, NV on a ghost hunting expedition. Virginia City is rife with macabre lore and reputed to be one of the most haunted cities in America. Ghost Adventures has won a Grand Jury Prize for Best Documentary that was given by the New York International Film &amp; Video Festival.",0.186205,,2007-07-25,0.0,87.0,9.0
Zapatlela,False,0,"['Horror', 'Comedy']",192573,tt0233979,mr,"Inspector Mahesh kills a gangster but his spirit enters into a near by doll. Later, a puppetry master receives this doll as a gift but this doll will turn his good life into hell.",0.0008439999999999999,,1993-01-01,0.0,150.0,9.0
Queens Of Evil,False,0,"['Fantasy', 'Horror']",88486,tt0066980,it,"A young hippie kills a man, and seeks refuge at the lakeside house of three beautiful sisters, who seem to be hiding a dark secret.",0.00022,,1970-12-11,0.0,90.0,9.0
Jennifer,False,0,['Horror'],66762,tt0077769,en,"Ostracized at a snooty private school because of her rural, poor background, a scholarship student is tormented to the point where her only remaining recourse is revenge, using the only method she knows: her psychic control over snakes!",0.468194,['American International Pictures (AIP)'],1978-05-13,0.0,90.0,8.7
Anabel,False,0,"['Thriller', 'Horror']",362579,tt5032026,es,"Anabel and his two roommates are looking for someone to share the rent. They choose an older gentleman who gain their trust, but soon they discover a strange and disturbing presence.",2.038121,"['Norberfilms', 'Roxbury']",2015-10-11,0.0,0.0,8.6
Demons,False,0,"['Horror', 'Foreign']",104548,tt0165473,ja,"Gengobe Satsuma, an exiled samurai cast out as an Asano clan retainer is given a second chance to join his brothers in arms to become the 48th Ronin against the Shogunate. His faithful servant gathers the 100 ryo required for his acceptance. Gengobe is also in love with a greedy geisha named Koman. About to be sold to another man, Gengobe learns that for him to keep her, her debt is exactly 100 ryo.",0.012236,"['Art Theatre Guild', 'Matsumoto Production Company']",1971-02-13,0.0,135.0,8.6
National Theatre Live: Frankenstein,False,0,"['Drama', 'Horror']",203912,tt1795369,en,"Childlike in his innocence but grotesque in form, Frankenstein’s bewildered creature is cast out into a hostile universe by his horror-struck maker. Meeting with cruelty wherever he goes, the friendless Creature, increasingly desperate and vengeful, determines to track down his creator and strike a terrifying deal.  Urgent concerns of scientific responsibility, parental neglect, cognitive development and the nature of good and evil are embedded within this thrilling and deeply disturbing classic gothic tale.",2.093311,,2011-03-17,0.0,132.0,8.5
Vampire in Venice,False,0,['Horror'],28198,tt0091651,en,"Professor Paris Catalano visits Venice, to investigate the last known appearance of the famous vampire Nosferatu during the carnival of 1786.",0.952127,"['Reteitalia', 'Scena Film']",1988-09-15,0.0,97.0,8.5
Salad Fingers,False,0,"['Animation', 'Horror', 'Science Fiction']",425916,tt1830238,en,"The adventures of Salad Fingers, an unspecified mutated creature driven to madness by his loneliness.",0.14136700000000002,,,0.0,52.0,8.5
The Strangler,False,0,['Horror'],42796,tt0058622,en,"An overweight lab technician with low self esteem, brought on by his dominant mother, becomes a serial killer of female nurses.",0.09055,['Bischoff-Diamond Corporation'],1964-04-01,0.0,89.0,8.5
The Legend of Sleepy Hollow,False,0,"['Comedy', 'Family', 'Fantasy', 'Horror']",170261,tt0079453,en,"A TV adaptation of Washington Irving's classic ghost story. Humor is the drawing card in this version, with Jeff Goldblum a nerdish Ichabod Crane, Dick Butkus an appropriately nasty Brom Bones, and Meg Foster as spirited Katrina van Tassel. Angered that Katrina has grown fond of schoolmaster Crane, Brom Bones determines to scare off the interloper by filling his head with spooky tales of a Headless Horseman. Crane pooh-poohs the legends, until one fateful ride home in the dark of night.",1.6506880000000002,['Schick Sunn Classics'],1980-10-31,0.0,104.0,8.5
Sweet Home,False,0,['Horror'],72834,tt0141861,ja,"A TV production crew are making a documentary about the infamous painter Mamiya Ichiro. When they start filming at his old home, they come under attack from the ghost of the painter's wife.",1.027139,['Itami Productions'],1989-01-21,0.0,102.0,8.4
Fists in the Pocket,False,0,"['Drama', 'Horror', 'Foreign']",46591,tt0059619,it,"Ale, a deeply disturbed young man subject to seizures, benignly decides to murder members of his dysfunctional family for altruistic reasons.",1.399107,['Doria'],1965-10-31,0.0,105.0,8.4
The Mummy's Tomb,False,0,"['Drama', 'Fantasy', 'Horror', 'Mystery', 'Thriller']",29239,tt0035096,en,A high priest of Karnak travels to America with the living mummy Kharis (Lon Chaney Jr.) to kill all those who had desecrated the tomb of the Egyptian princess Ananka thirty years earlier.,0.674417,['Universal Pictures'],1942-10-23,0.0,60.0,8.3
Black Mirror: White Christmas,False,0,"['Drama', 'Horror', 'Mystery', 'Science Fiction', 'Thriller', 'TV Movie']",374430,tt3973198,en,"This feature-length special consists of three interwoven stories. In a mysterious and remote snowy outpost, Matt and Potter share a Christmas meal, swapping creepy tales of their earlier lives in the outside world. Matt is a charismatic American trying to bring the reserved, secretive Potter out of his shell. But are both men who they appear to be? A woman gets thrust into a nightmarish world of 'smart' gadgetry. Plus a look at what would happen if you could 'block' people in real life.",24.910782,,2014-12-16,0.0,74.0,8.3
Psycho,False,806948,"['Drama', 'Horror', 'Thriller']",539,tt0054215,en,"When larcenous real estate clerk Marion Crane goes on the lam with a wad of cash and hopes of starting a new life, she ends up at the notorious Bates Motel, where manager Norman Bates cares for his housebound mother. The place seems quirky, but fine… until Marion decides to take a shower.",36.826309,"['Paramount Pictures', 'Universal Pictures', 'Shamley Productions']",1960-06-16,32000000.0,109.0,8.3
City of Pirates,False,0,"['Drama', 'Fantasy', 'Horror', 'Thriller']",68757,tt0086546,fr,"A surreal odyssey in which a melancholic maidservant crosses paths with a homicidal little boy, travels to a tiny island of pirates and encounters a man with multiple personalities.",0.003013,"['Metro Filmes', 'Les Films du Passage']",1984-02-22,0.0,111.0,8.3
Woyzeck,False,0,"['Drama', 'Foreign', 'Horror']",48199,tt0111749,en,"Lajos Kovács (WINGS OF DESIRE) stars as the misused Woyzeck, who ekes out a miserable existence sweeping train tracks, running errands for a bullying army captain and acting as a human guinea pig for a local doctor with ideas about free will. When his common-law wife begins an affair with a local cop, Woyzeck's pocket Bible and near-starvation diet point him on a downward spiral of twisted redemption.",0.226192,,1994-02-07,0.0,93.0,8.3
Ward 13,False,0,"['Animation', 'Horror', 'Action', 'Comedy']",48585,tt0379000,en,"After a car accident, Ben wakes up in hospital. Not knowing where he is or what is going on, he starts exploring the corridors...only to find that the staff don't have his health in mind! The hapless patient must pull himself together and do everything he can to escape. It's an action/horror/comedy — ending with the wheelchair chase from hell!",0.17899,,2003-01-01,0.0,15.0,8.2
The Shining,False,19000000,"['Horror', 'Thriller']",694,tt0081505,en,"Jack Torrance accepts a caretaker job at the Overlook Hotel, where he, along with his wife Wendy and their son Danny, must live isolated from the rest of the world for the winter. But they aren't prepared for the madness that lurks within.",19.611589,"['Hawk Films', 'Warner Bros.', 'Peregrine']",1980-05-22,44017374.0,144.0,8.1
Michael Jackson's Thriller,False,1100000,"['Horror', 'Music']",92060,tt0088263,en,A night at the movies turns into a nightmare when Michael and his date are attacked by a hoard of bloody-thirsty zombies.,17.85649,['Optimum Productions'],1983-12-02,0.0,13.0,8.1
Forklift Driver Klaus: The First Day on the Job,False,0,"['Horror', 'Comedy']",9677,tt0289477,de,Short film depicting a fictional educational film about fork lift truck operational safety. The dangers of unsafe operation are presented in gory details.,3.067015,"['Rough Trade Distribution GmbH', 'Anolis Entertainment', 'e-m-s GmbH']",2001-08-08,0.0,10.0,8.1
Spoiler,False,0,"['Science Fiction', 'Thriller', 'Horror']",28646,tt0120187,en,"Roger Mason is a prisoner locked away in a futuristic fortress of a jail. Desperate to escape and see his daughter, he keeps making attempt after attempt to break free, but each one is foiled just as he's about to gain his freedom. As his punishments include being frozen in suspended animation for years at a time, he stays the same age while his daughter grows older. As more time keeps being added to his sentence, he despairs of ever getting out.",0.972229,['Ed Ancoats Inc.'],1998-09-15,0.0,99.0,8.0
The Ghost Story of Oiwa's Spirit,False,0,['Horror'],198225,tt0122564,ja,"Yotsuya Kaidan, the story of Oiwa and Tamiya Iemon, is a tale of betrayal, murder and ghostly revenge. Arguably the most famous Japanese ghost story of all time, it has been adapted for film over 30 times, and continues to be an influence on Japanese horror today.Written in 1825 by Tsuruya Nanboku IV as a kabuki play, the original title was Tōkaidō Yotsuya Kaidan.",0.13967000000000002,['Toei Company'],1961-01-01,0.0,94.0,8.0
A Reflection of Fear,False,0,['Horror'],104644,tt0070599,en,"A young girl lives with her mother and grandmother. One day her estranged father returns home with a female companion he introduces as his fiance. Soon the girl finds herself in the midst of strange goings-on, which evolve into a web of crime and murder.",0.045860000000000005,,1973-02-12,0.0,89.0,8.0
Midnight Ride,False,0,"['Thriller', 'Action', 'Horror']",31942,tt0100148,en,"A house wife just left her cop husband, when she picks up Justin McKay she'll wish she never did as she's plunged into a nightmare and the grip of a psychotic killer.",0.766401,,1990-01-01,0.0,93.0,8.0
Julie Darling,False,2000000,"['Drama', 'Horror', 'Thriller']",81475,tt0084182,en,A teenage girl whose inaction caused her mother's death arranges a similarly gruesome fate for her stepmother and brother.,0.079137,"['TAT Filmproduktion', 'Cinequity Corporation']",1983-03-01,0.0,100.0,8.0
The Man Without a Face,False,0,"['Crime', 'Drama', 'Horror']",210653,tt0043647,es,A faceless killer who hunts women can only be stopped by a detective with a disturbing past.,0.917711,['Oro Films'],1950-07-29,0.0,91.0,8.0
Sombre,False,0,"['Drama', 'Horror']",56653,tt0166808,fr,A serial killer stalks sisters he befriended after their car broke down.,0.865784,"['Arte', 'Canal+', 'Centre National de la Cinématographie (CNC)']",1998-08-06,0.0,112.0,8.0
Dreadnaught,False,0,"['Crime', 'Action', 'Thriller', 'Horror']",64305,tt0083352,cn,"A short-tempered, violent criminal named ""White Tiger"" is on the run from the police and joins a theater troupe for disguise, killing anyone who angers him or who suspects his identity. One person he unsuccessfully tries to kill several times is a cowardly laundry man named ""Mousy"" who manages to escape mostly by running and hiding. When a very close friend of Mousy's is killed by the White Tiger, Mousy overcomes his cowardliness enough to seek revenge. Spectacular martial arts and acrobatics highlight the film, including a well choreographed fight between two pairs of men in dragon costume.",0.412425,['Golden Harvest Productions'],1981-03-26,0.0,91.0,8.0
Blood of the Beasts,False,0,"['Documentary', 'Horror']",91262,tt0041842,fr,"An early example of ultra-realism, this movie contrasts the quiet, bucolic life in the outskirts of Paris with the harsh, gory conditions inside the nearby slaughterhouses. Describes the fate of the animals and that of the workers in graphic detail.",1.235239,['Forces et voix de la France'],1949-01-01,0.0,20.0,8.0
Ghost of Love,False,0,"['Romance', 'Drama', 'Horror', 'Mystery']",116997,tt0082364,it,"After witnessing the brutal murder of an elderly lady, a man has an encounter with a bizarre woman who claims to be an old lover of his... A lover who apparently committed suicide years ago.",0.5344220000000001,"['Bayerischer Rundfunk (BR)', 'Dean Film', 'Roxy-Film GmbH & Co. KG']",1981-04-03,0.0,96.0,8.0
The Sleepover,False,0,"['Comedy', 'Horror']",141210,tt2250194,en,"The town of Derry has a secret, but no one told the new kid. It's gonna be a long night.",0.135596,,2013-10-12,0.0,6.0,8.0
