Title,adult,budget,genres,id,imdb_id,original_language,overview,popularity,production_companies,release_date,revenue,runtime,vote_average
Elaine Stritch: At Liberty,False,300000,"['Comedy', 'Documentary', 'Music', 'TV Movie']",140595,tt0308213,en,Judy at the Palace. Sinatra at Carnegie Hall. Streisand at the Garden. Stritch on Broadway. Legendary performances come along so rarely.,0.089067,"['Pennebaker Hegedus Films, Inc.', 'Second Act Productions']",2002-01-01,0.0,140.0,10.0
Criminal Justice,False,0,"['TV Movie', 'Drama']",259808,tt0099321,en,A knife-scarred victim must identify her assailant beyond a reasonable doubt. Meanwhile the accused is offered a deal if he pleads guilty. Is he as innocent as the victim? Is the justice system guiltier than both?,1.460826,['Home Box Office (HBO)'],1990-09-08,0.0,90.0,10.0
Katt Williams: Priceless: Afterlife,False,0,"['TV Movie', 'Comedy']",287299,tt3742040,en,"Katt Williams performs in an all-new stand-up special recorded in front of a live audience at the Citizens Bank Arena in Ontario, California. Williams takes the stage and launches into an hour of frenetic stand-up comedy, covering such topics as the allure of California weed dispensaries; how America handles tragedies; getting rid of racism in 2014; his inspirations and his favorite TV show; homophobia and the first openly gay players in major sports; aggressive police tactics; being sent to a mental institution; doctors and the problem with drug commercials; the pros and cons of being single versus being in a relationship; and more.",0.476007,['New Wave Entertainment Television'],2014-08-16,0.0,58.0,10.0
Shark Kill,False,0,"['TV Movie', 'Adventure']",97593,tt0075205,en,Two adventurers set sail to find a giant man-eating great white shark.,0.011938,"[""D'Antoni/Weitz Productions""]",1976-05-20,0.0,76.0,10.0
Heavy Weather,False,0,"['Comedy', 'TV Movie']",144183,tt0111998,en,"At Blandings Castle, the Earl of Emsworth only cares about his prize pig 'The Empress' and is wilfully ignorant of the fact that his brother is planning to publish a book which might ruin the family name forever. Moreover, the Earl's nephew might cause the family some major damage by getting married to a terribly unsuitable chorus girl. An adaptation of P.G. Wodehouse's novel of the same name.",0.080985,"['British Broadcasting Corporation (BBC)', 'WGBH', 'Juniper Films', 'Cinema Verity']",1995-12-24,0.0,95.0,10.0
Deliver Us from Evil,False,0,"['Crime', 'Drama', 'TV Movie']",184061,tt0069961,en,"Several men hiking in the mountains discover an injured skyjacker who parachuted from a plane with $600,000. They kill him, then start fighting each other over the money.",0.317373,['Playboy Productions'],1973-09-11,0.0,75.0,10.0
Serving Life,False,0,"['TV Movie', 'Documentary']",98554,tt1699762,en,"""Serving Life"" is the first OWN original documentary airing on the network narrated and executive produced by Academy Award winner Forest Whitaker.  The film takes viewers inside Louisiana's maximum security prison at Angola, where the average sentence is more than 90 years.  The prisoners within its walls are the worst of the worst - rapists, kidnappers and murderers.  With prison sentences so long, 85 percent will never again live in the outside world.  Instead, the will grow old and die in Angola.  ""Serving Life"" documents an extraordinary hospice program where hardened criminals care for their dying fellow inmates.",0.255898,,2011-07-28,0.0,0.0,9.0
Den radio,False,0,['TV Movie'],143883,tt5952180,ru,,0.6714220000000001,,2001-03-24,0.0,0.0,9.0
Die zwölf Geschworenen,False,0,"['TV Movie', 'Drama', 'Crime']",269165,tt0057723,de,,0.074898,['TV-60 Filmproduktion'],1963-10-25,0.0,,9.0
Allen Iverson: The Answer,False,0,"['Documentary', 'TV Movie']",449012,tt6304902,en,"NBA TV will feature the primetime special — Allen Iverson: The Answer — during its extensive 2016 Finals coverage on Monday, June 6, at 8 p.m. ET, with the fearless and sometimes misunderstood Iverson looking back at his Hall of Fame playing career and the moments that made him one of the most talked about figures in NBA history.  During the hour-long special, NBA TV’s Steve Smith interviews Iverson about the difficult journey from Hampton, Va., to Georgetown University, his selection as the first overall pick in the 1996 NBA Draft, his close relationship with “The City of Brotherly Love” and carrying the 76ers to The Finals, his unapologetic scoring mentality, the famous “Practice” press conference, regrets about leaving Philadelphia, and his impact on pop culture.",0.147584,,2016-06-06,0.0,46.0,9.0
"Murder, She Baked: A Peach Cobbler Mystery",False,0,"['TV Movie', 'Mystery']",371181,tt5317546,en,"With The Cookie Jar, Hannah Swensen has a mouthwatering monopoly on the bakery business of Lake Eden, Minnesota. But when a rival store opens, and one of the owners is found shot to death in the store, Hannah is determined to prove that she wasn't the only one who had an axe to grind with the Quinn sisters. Somebody wasn't fooled by the Georgia Peaches and their sweet-as-pie act--and now it's up to Hannah to track down whoever had the right ingredients to whip up a murder.",3.504021,,2016-01-10,0.0,84.0,8.6
Starving in Suburbia,False,0,"['Drama', 'TV Movie']",273059,tt3257692,en,"When seventeen-year-old Hannah stumbles upon a website about Thinspiration--an online community devoted to anorexia as a life choice--she becomes an obsessive follower of the site founder, ButterflyAna. By the time Hannah's family realizes what is happening and get Hannah the help she needs, the disease has fully taken hold and Hannah is refusing to eat. Will this family be able to exorcise the demon of anorexia from their lives?",0.780125,['Indy Entertainment'],2014-04-26,0.0,84.0,8.5
SUBWAYStories: Tales from the Underground,False,0,"['TV Movie', 'Comedy', 'Drama']",209802,tt0120240,en,"The actual experiences of New York City subway riders are dramatized in a collection of 10 intriguing and very different vignettes. The tales showcase an ensemble of familiar faces, and range from stories of compassion and love to reflections on violence and loss. Among them: a disabled beggar quarrels with a woman and ruins her shoes with his wheelchair, provoking onlookers to wrath and pity; a skittish tourist proves to be her own worst enemy; a newlywed trysts with a mysterious sexpot; a commuter helplessly witnesses a suicide attempt; and, in the most affecting segment, a young woman grieves over her mother's imminent death.",0.968414,"['Clinica Estetico', 'Home Box Office (HBO)', 'HBO NYC Productions', 'Ten in a Car Productions']",1997-07-24,0.0,80.0,8.5
Black Mirror: White Christmas,False,0,"['Drama', 'Horror', 'Mystery', 'Science Fiction', 'Thriller', 'TV Movie']",374430,tt3973198,en,"This feature-length special consists of three interwoven stories. In a mysterious and remote snowy outpost, Matt and Potter share a Christmas meal, swapping creepy tales of their earlier lives in the outside world. Matt is a charismatic American trying to bring the reserved, secretive Potter out of his shell. But are both men who they appear to be? A woman gets thrust into a nightmarish world of 'smart' gadgetry. Plus a look at what would happen if you could 'block' people in real life.",24.910782,,2014-12-16,0.0,74.0,8.3
George Carlin: Life Is Worth Losing,False,0,"['Documentary', 'Comedy', 'TV Movie']",13015,tt0484855,en,"Carlin returns to the stage in his 13th live comedy stand-up special, performed at the Beacon Theatre in New York City for HBO®. His spot-on observations on the deterioration of human behavior include Americans’ obsession with their two favorite addictions - shopping and eating; his creative idea for The All-Suicide Channel, a new reality TV network; and the glorious rebirth of the planet to its original pristine condition - once the fires and floods destroy life as we know it.",4.8066510000000005,['Cable Stuff Productions'],2005-11-05,0.0,74.0,8.1
Style Wars,False,0,"['Music', 'Documentary', 'TV Movie']",29587,tt0177262,en,"Some call it tagging, some call it writing, still others call it bombing--it's all graffiti. Whether it's art or not is another matter, but it's undeniably illegal. Tony Silver and Henry Chalfant's historic PBS documentary Style Wars tracks the rise and fall of subway graffiti in New York in the late 1970s and early 1980s.",0.870267,['Public Art Films'],1983-01-01,0.0,70.0,8.1
Glitterbug,False,0,"['Music', 'TV Movie', 'Documentary']",140527,tt0109909,en,A collage of Derek Jarman's super 8 footage spanning over 20 years.,0.686753,"['British Broadcasting Corporation (BBC)', 'Basilisk Communications', 'Dangerous To Know', 'Opal Records']",1994-03-05,0.0,60.0,8.0
Autumn in the Vineyard,False,0,"['TV Movie', 'Romance']",413441,tt6041048,en,"When Frankie Baldwin and Nate Deluca both have a claim to ownership of Sorrento Farm, they are forced to divide the vineyard right down the middle and work the fields alongside each other to bring in the harvest leading up to the Best Wine competition at the annual Autumn Harvest Festival -- only this rivalry won't be settled in the fields, because in spite of their contentious bickering, the simplest way to settle this particular legal dispute is with a romance.",0.519491,,2016-10-08,0.0,84.0,8.0
"Signed, Sealed, Delivered: Lost Without You",False,0,"['Drama', 'TV Movie', 'Comedy']",414762,tt6047684,en,"Oliver's (Eric Mabius) Divine Delivery Theory is put to the test when he and the POstables (Kristin Booth, Geoff Gustafson and Crystal Lowe) seem to be unable to deliver a damaged letter from a military veteran that's a matter of life and death",0.136178,,2016-09-25,0.0,84.0,8.0
"Murder, She Baked: A Plum Pudding Murder Mystery",False,0,"['TV Movie', 'Mystery']",361751,tt4933782,en,"A young bakeshop owner’s holiday season takes a surprising turn when she finds a body at a local Christmas tree lot and winds up involved in a dangerous murder investigation. With colorful characters popping up as suspects, shady business practices uncovered at the tree lot and holiday romance in the air, the young baker-turned-sleuth must race against time to track down the killer and save the Christmas season.",4.653375,"['Front Street Pictures', 'Brad Krevoy Television']",2015-11-15,0.0,84.0,8.0
George Carlin: You Are All Diseased,False,0,"['Comedy', 'Documentary', 'TV Movie']",34513,tt0246645,en,"Legendary comic Carlin comes back to the Beacon theater to angrily rant about airport security, germs, cigars, angels, children and parents, men, names, religion, god, advertising, Bill Jeff and minorities.",0.897667,['Cable Stuff Productions'],1999-02-06,0.0,65.0,8.0
True Siblings,False,0,"['Drama', 'TV Movie']",336970,tt0227590,sv,"The siblings Linus, 19-years-old, who are taking driving license and Vanja, 17-years-old, who's still in school. Their mom Eva works night shift at a hotel. We get to follow them during one month. Linus and Vanja begin to realize that they are living in a universe of their own. And there is neither room for the mom or boy- and girlfriends. At first it is only the longing love in unspoken thoughts. But when thought gets into words they realize that they are each others perfect half. They are drawn closer to each other and finally can't resist the taboo temptation in each others bodies. At first they deny, lie and try to resist. It's about shame and guilt and forbidden feelings which leads to a point where everything is at stake.",2.3643549999999998,['SVT Drama'],2000-09-13,0.0,58.0,8.0
Prime Suspect: The Final Act,False,0,"['Drama', 'Crime', 'TV Movie', 'Mystery']",263946,tt0811026,en,"Helen Mirren returns for the final time as Jane Tennison in the long-awaited Prime Suspect 7. Retirement looms for Detective Superintendent Tennison, but as her career draws to a close, the body of a missing schoolgirl is found, and the hunt for her killer begins. However, as Jane and her colleagues work to identify their prime suspect, the emotional fallout from the murder begins to take its toll on the battle-scarred detective. As the investigation gets underway, Jane is not only dealing with the imminent death of her father, but also an addiction to alcohol which she is desperately trying to keep hidden. There are plenty of twists and turns as Jane confronts her toughest challenge yet: herself, as the popular award-winning series reaches its devastating finale.",0.678719,,2006-11-12,0.0,182.0,8.0
Fish Heads,False,0,"['TV Movie', 'Music']",115161,tt0218976,en,"A short, surreal movie which becomes a music video, starring a young Bill Paxton and Bill Mumy of Lost in Space fame. Was shown somewhat frequently in the early days of MTV.",0.00335,,1980-01-01,0.0,5.0,8.0
Trench of Hope,False,0,"['TV Movie', 'History', 'Drama']",227481,tt0386831,fr,"While playing football, two children stumble across the grave of a French WWI infantryman who died in the trenches in 1918. His name was Pierre Delpeuch and in the last days of his life he and his comrades shared an extraordinary human adventure. Exhausted, cut off from the front, huddled in their trench, Pierre and four others bravely stood firm. Facing them was another trench containing five similar exhausted and determined Germans. Their only aim was to resist, whatever the cost, until reinforcements arrived.",0.411336,,2003-11-10,0.0,110.0,8.0
Solyaris,False,0,"['TV Movie', 'Drama', 'Science Fiction']",321130,tt1808482,ru,"Kris Kelvin joins the space station orbiting the planet Solaris, only to find its two crew members plagued by ""phantoms,"" creations of Solaris. Kelvin is soon confronted with his own phantom, taking the shape of his dead wife Hari.",0.250398,"['Studio ""Orlenok"", Central Television USSR', 'Iz Sobraniya Gosteleradio']",1968-10-08,0.0,142.0,8.0
Before the Flood,False,0,"['Documentary', 'TV Movie']",410718,tt5929776,en,"A look at how climate change affects our environment and what society can do prevent the demise of endangered species, ecosystems, and native communities across the planet.",5.812786,"['Appian Way', 'National Geographic Channel', 'RatPac Documentary Films']",2016-10-21,0.0,93.0,7.9
"Signed, Sealed, Delivered for Christmas",False,0,"['Family', 'TV Movie']",308686,tt4065336,en,"With a duty to deliver every last letter before Christmas, the beloved quartet of post office detectives—Oliver, Shane, Rita and Norman—are working around the clock to redirect Santa’s mail just as Oliver runs into his former Sunday school teacher. When they receive an emotional last-minute plea not meant for Saint Nick, but instead written to God, they must delay their own travel plans to make sure one little girl doesn’t lose her Christmas joy—something Oliver and Shane are also struggling to find as they each face painful holiday memories. With a little guidance from a mysterious post office volunteer, Jordan, the Postables are more surprised than anyone to discover they've been a part of more than one miracle on this Christmas Eve.",0.621576,"['Muse Entertainment Enterprises', 'Moon Water Productions']",2014-11-23,0.0,84.0,7.9
River,False,0,"['Crime', 'Drama', 'Mystery', 'TV Movie']",371504,tt4258440,en,"John River, a brilliant police officer whose genius and fault-line is the fragility of his mind - a man haunted by the murder victims whose cases he must lay to rest",2.444659,['Kudos Film and Television'],2015-10-13,0.0,349.0,7.9
Doctor Who: The Runaway Bride,False,0,"['Science Fiction', 'TV Movie']",282758,tt0827573,en,A young bride in the midst of her wedding finds herself mysteriously transported to the TARDIS. The Doctor must discover what her connection is with the Empress of Racnoss's plan to destroy the world.,2.88026,,2007-07-06,0.0,60.0,7.9
George Carlin: Jammin' in New York,False,0,"['Documentary', 'Comedy', 'TV Movie']",25161,tt0246643,en,"When George Carlin is asked which HBO concert is his favorite, his answer is always, ""Jammin’ In New York."" The show, taped at the Paramount Theater in Madison Square Garden and winner of the 1992 CableACE Award, is a perfect blend of biting social commentary and more gently-observed observational pieces.",1.88795,['Cable Stuff Productions'],1992-04-24,0.0,59.0,7.8
George Carlin: Complaints & Grievances,False,0,"['Comedy', 'Documentary', 'TV Movie']",20679,tt0287460,en,"George Carlin performs a hilarious set of never-before released material in ""Complaints and Grievances."" His 12th HBO special was recorded live at the Beacon Theater in New York City on November 17, 2001. In ""Complaints and Grievances,"" Carlin shamelessly exposes the people and subjects that irritate him the most.",1.03164,['Cable Stuff Productions'],2001-11-17,0.0,56.0,7.8
The Lorax,False,0,"['Animation', 'Family', 'TV Movie']",38060,tt0213065,en,"The Once-ler, a ruined industrialist, tells the tale of his rise to wealth and subsequent fall, as he disregarded the warnings of a wise old forest creature called the Lorax about the environmental destruction caused by his greed.",1.6892150000000001,"['Columbia Broadcasting System (CBS)', 'DePatie-Freleng Enterprises (DFE)', 'The Cat in the Hat Productions']",1972-02-14,0.0,25.0,7.8
Thief,False,0,"['Crime', 'Drama', 'Thriller', 'TV Movie']",265758,tt0454753,en,"Andre Braugher stars as Nick Atwater, the leader of a robbery crew balancing his personal life with the planning of a major heist. The crew is being targeted by a relentless cop and the Chinese mafia every step of the way, while Atwater struggles at home with his teenage stepdaughter (Mae Whitman).",0.908246,,2006-03-27,0.0,360.0,7.8
The Night That Panicked America,False,0,"['Drama', 'TV Movie']",83849,tt0073454,en,"A dramatization of the Oct. 30, 1938 mass panic that Orson Welles' radio play, ""The War of the Worlds"" accidentally provoked.",0.099183,"['Paramount Television', 'The Culzean Corporation']",1975-10-31,0.0,92.0,7.8
The War Game,False,0,"['Science Fiction', 'Drama', 'War', 'Documentary', 'TV Movie']",26508,tt0059894,en,"The War Game is a fictional, worst-case-scenario docudrama about nuclear war and its aftermath in and around a typical English city. Although it won an Oscar for Best Documentary, it is fiction. It was intended as an hour-long program to air on BBC 1, but it was deemed too intense and violent to broadcast. It went to theatrical distribution as a feature film instead. Low-budget and shot on location, it strives for and achieves convincing and unflinching realism.",1.761241,['British Broadcasting Corporation (BBC)'],1965-11-01,0.0,48.0,7.8
George Carlin: Back in Town,False,0,"['Comedy', 'Documentary', 'TV Movie']",34509,tt0246641,en,"Back in Town is George Carlin's ninth HBO special. It was also released on CD on September 17, 1996. This was also his first of many performances at the Beacon Theater in New York City. He rants about Abortion, The death penalty, prison farms, fart jokes, free floating hostility and words.",1.3816959999999998,,1996-03-11,0.0,63.0,7.8
A Night at the Movies: The Horrors of Stephen King,False,0,"['Documentary', 'TV Movie']",163250,tt2076787,en,Author Stephen King discusses the various types of horror films and why they are so popular with moviegoers.,0.679242,"['Amblin Television', 'Turner Classic Movies (TCM)']",2011-10-03,0.0,58.0,7.7
A Christmas Memory,False,0,"['TV Movie', 'Drama', 'Family']",79818,tt0135187,en,"A boy, Buddy, whose parents have split and whose mother is an actress in New York, has been dumped in the south at the small-town home of some older cousins, all of whom are unmarried.",0.239863,,1997-12-21,0.0,96.0,7.7
"Scream, Pretty Peggy",False,0,"['Drama', 'Horror', 'Mystery', 'Thriller', 'TV Movie']",206630,tt0070657,en,"A sculptor hires young college girls to take care of his elderly mother and his supposedly insane sister, both of whom live in the old family mansion with him.",0.35504,['Universal TV'],1973-11-24,0.0,74.0,7.7
